<!ELEMENT cifp (alumne | professor)*>
<!ELEMENT alumne (nom, llinatges, data_naixement?, correu?, telefon?, adreça?, data_matricula, curs)>
<!ATTLIST alumne id CDATA #REQUIRED>
<!ELEMENT professor (nom, llinatges, data_naixement?, correu?, telefon?, adreça?, data_incorporació, departament, assignatura*)>
<!ATTLIST professor id CDATA #REQUIRED>
<!ELEMENT nom (#PCDATA)>
<!ELEMENT llinatges (#PCDATA)>
<!ELEMENT data_naixement (#PCDATA)>
<!ELEMENT correu (#PCDATA)>
<!ELEMENT telefon (#PCDATA)>
<!ELEMENT adreça (#PCDATA)>
<!ELEMENT data_matricula (#PCDATA) >
<!ELEMENT curs (DAM|DAW|ASIX|SMX|SEIA|ER|AUT)> 
<!ELEMENT DAW EMPTY> 
<!ELEMENT DAM EMPTY> 
<!ELEMENT ASIX EMPTY> 
<!ELEMENT SMX EMPTY> 
<!ELEMENT SEIA EMPTY> 
<!ELEMENT ER EMPTY> 
<!ELEMENT AUT EMPTY> 
<!ELEMENT data_incorporació (#PCDATA)>
<!ELEMENT departament (Informàtica | Electricitat | Automoció)>
<!ELEMENT Informàtica EMPTY> 
<!ELEMENT Electricitat EMPTY> 
<!ELEMENT Automoció EMPTY> 
<!ELEMENT assignatura (nom_assignatura, data_inici?, data_final?)>
<!ATTLIST assignatura id_assignatura CDATA #REQUIRED>
<!ELEMENT nom_assignatura (#PCDATA)>
<!ATTLIST nom_assignatura cicle (DAM | DAW | ASIX | SMX | SEIA | ER | AUT) #REQUIRED>
<!ELEMENT data_inici (#PCDATA)>
<!ELEMENT data_final (#PCDATA)>